{
  "generated_at": "2026-04-19T05:10:00Z",
  "learning_challenger_bypass_suppressed_total": 3,
  "learning_eligible_override_tradable_total": 3,
  "learning_selection_cost_override_applied_total": 2,
  "learning_challenger_bypass_suppressed": [
    {
      "pair_id": "PF_DOGEUSD__PF_PEPEUSD",
      "timeframe": "15m",
      "suppressed_total": 2
    },
    {
      "pair_id": "PF_SOLUSD__PF_AVAXUSD",
      "timeframe": "1h",
      "suppressed_total": 1
    }
  ],
  "learning_eligible_override_tradable": [
    {
      "pair_id": "PF_SOLUSD__PF_AVAXUSD",
      "timeframe": "15m",
      "surfaced_total": 2
    },
    {
      "pair_id": "PF_SUIUSD__PF_ARBUSD",
      "timeframe": "1h",
      "surfaced_total": 1
    }
  ],
  "learning_selection_cost_override_applied": [
    {
      "pair_id": "PF_DOGEUSD__PF_PEPEUSD",
      "timeframe": "15m",
      "applied_total": 2
    }
  ]
}
